{
  "$id": "https://w3id.org/traceability/schemas/CertifidMillTestReportCredential.json",
  "$schema": "http://json-schema.org/draft-07/schema#",
  "$comment": "{\"term\": \"CertifidMillTestReportCredential\", \"@id\": \"https://w3id.org/traceability#CertifidMillTestReportCredential\"}",
  "title": "Certified Mill Test Report Verifiable Credential",
  "description": "Certifications made by a manufacturer of a metal product.",
  "type": "object",
  "properties": {
      "@context": {
        "type": "array"
      },
      "type": {
        "oneOf": [
          {
            "type": "string"
          },
          {
            "type": "array"
          }
        ]
      },
      "id": {
        "type": "string"
      },
      "name": {
        "type": "string"
      },
      "description": {
        "type": "string"
      },
      "issuanceDate": {
        "type": "string"
      },
      "issuer": {
        "type": "object"
      },
      "credentialSubject": {
        "type": "object"
      },
      "proof": {
        "type": "object"
      },
      "relatedLink": {
        "$comment": "{\"term\": \"relatedLink\", \"@id\": \"https://w3id.org/traceability#LinkRole\"}",
        "title": "Related Link",
        "description": "Links related to this verifiable credential",
        "type": "array",
        "items": {
          "$ref": "https://w3id.org/traceability/schemas/LinkRole.json"
        }
      }
    },
  "additionalProperties": false,
  "required": ["proof"],
  "examples": []
}
