{
  "@context": [
    "https://www.w3.org/2018/credentials/v1",
    "https://w3id.org/traceability/v1"
  ],
  "id": "https://example.com/credentials/123",
  "type": [
    "VerifiableCredential"
  ],
  "issuanceDate": "2021-02-04T20:29:37+00:00",
  "issuer": {
    "id": "did:example:123"
  },
  "credentialSubject": {
    "id": "did:web:www.acme.com",
    "type": "EcommerceProductRegistrationCredential",
    "productCode": 14,
    "productCodeType": "GTIN",
    "certificateName": "ACME Ecommerce Product Registration Credential"
  },
  "proof": {
    "type": "Ed25519Signature2018",
    "created": "2021-02-24T21:34:58.884Z",
    "jws": "eyJhbGciOiJFZERTQSIsImI2NCI6ZmFsc2UsImNyaXQiOlsiYjY0Il19..7uqXwcLt0qUi5R-Nyervw3MhUYBEeb59JhVhOBkda2TQ_6R6MA8eTvE_wIOLhB3U9P0_zycZQ8tJ_Cy99SsEAQ",
    "proofPurpose": "assertionMethod",
    "verificationMethod": "did:example:123#key-0"
  }
}