{
  "@context": [
    "https://www.w3.org/2018/credentials/v1",
    "https://w3id.org/traceability/v1"
  ],
  "id": "http://example.com/credentials/3a185b8f-078a-4646-8343-76a45c2856a5",
  "type": [
    "VerifiableCredential"
  ],
  "issuer": {
    "id": "did:example:123",
    "type": [
      "Organization"
    ],
    "url": "https://example.com/organizations/3a185b8f-078a-4646-8343-76a45c2856ad",
    "name": "Crude Oil Producer"
  },
  "issuanceDate": "2020-04-09T21:12:12Z",
  "credentialSubject": {
    "id": "did:examle:123",
    "type": "CrudeOilProduct",
    "HSCode": "270900",
    "UWI": "100.12-04-091-05-W5.00",
    "productionDate": "2020-03-30",
    "facility": {
      "type": "Place",
      "address": {
        "type": "PostalAddress",
        "organizationName": "Example Crude Producer",
        "addressRegion": "Edmonton",
        "addressCountry": "Canada"
      },
      "geo": {
        "type": "GeoCoordinates",
        "latitude": "53.5461",
        "longitude": "113.4938"
      }
    },
    "product": {
      "type": "Product",
      "name": "Heavy Sour Dilbit",
      "sizeOrAmount": {
        "type": "MeasuredValue",
        "unitCode": "bbl",
        "value": "10000"
      },
      "description": "Crude oil stream, produced from diluted bitumen."
    },
    "observation": [
      {
        "type": "Observation",
        "property": {
          "type": "MechanicalProperty",
          "name": "api Gravity"
        },
        "measurement": {
          "type": "MeasuredValue",
          "unitCode": "test",
          "value": "21"
        }
      },
      {
        "type": "Observation",
        "property": {
          "type": "MechanicalProperty",
          "name": "viscosityAt10C"
        },
        "measurement": {
          "type": "MeasuredValue",
          "unitCode": "test",
          "value": "302"
        }
      }
    ]
  },
  "proof": {
    "type": "Ed25519Signature2018",
    "created": "2021-03-02T20:37:27.382Z",
    "jws": "eyJhbGciOiJFZERTQSIsImI2NCI6ZmFsc2UsImNyaXQiOlsiYjY0Il19..9cd9MXvkZ_cRedSE2vdvCfEV9iFDr121SASZazTSAcbUJNLQ8bPKUeFVSO4QkHdr1yWnTz4D9QH39gX6qfq7Aw",
    "proofPurpose": "assertionMethod",
    "verificationMethod": "did:example:123#key-0"
  }
}