{
  "@context": [
    "https://www.w3.org/2018/credentials/v1",
    "https://w3id.org/traceability/v1"
  ],
  "id": "https://example.com/credentials/123",
  "type": [
    "VerifiableCredential"
  ],
  "issuanceDate": "2021-02-04T20:29:37+00:00",
  "issuer": {
    "id": "did:example:123"
  },
  "credentialSubject": {
    "id": "did:web:www.acme.com",
    "type": "EcommerceWayBillRegistrationCredential",
    "wayBillID": "ACMEWayBill#375",
    "carrierName": "Zemlak Inc",
    "modeOfTransport": "Truck",
    "portOfEntry": {
      "type": "ShippingStop",
      "shippingStopAddress": {
        "type": "PostalAddress",
        "organizationName": "Moore - Jacobs",
        "streetAddress": "02932 Schaden Locks",
        "addressLocality": "Codybury",
        "addressRegion": "Montana",
        "postalCode": "54086-6140",
        "addressCountry": "American Samoa"
      },
      "carrier": {
        "type": "Organization",
        "name": "Leannon - Durgan",
        "description": "Optimized local collaboration",
        "address": {
          "type": "PostalAddress",
          "streetAddress": "330 Paucek Corner",
          "addressLocality": "South Marjorieland",
          "addressRegion": "New Mexico",
          "postalCode": "80193",
          "addressCountry": "Equatorial Guinea"
        },
        "email": "Wade.Spinka93@example.org",
        "phoneNumber": "555-264-6962",
        "faxNumber": "555-779-3805"
      },
      "vesselNumber": "ACMECarrierVessel#401",
      "arrivalDate": "2-1-2021",
      "stopType": "Stopover"
    },
    "masterWayBill": "No",
    "wayBillVCID": [
      "https://vc.example.com/?queryID=0xFcFFC16684C56a38c8ECfEc124deF735b6D7ACf3ff7c66B9B5DdE1b0bdB4e1f8"
    ],
    "packageVCID": [
      "https://vc.example.com/?queryID=0xfE71c4b0F7C8A5bCc7F6db636B310F9A84600B4ffABAd1E7e2ECCd972186e7eA",
      "https://vc.example.com/?queryID=0xde6Dca82FfCAfc5A5a0bf9209240Dea6cbfD35d9bA45E1d6f3DEdB6d2DaB449D",
      "https://vc.example.com/?queryID=0xDb7B2D76D255e90B7C603bb9a4f2575E374bcf871F5F55faf636F05dFb91067D",
      "https://vc.example.com/?queryID=0xd5e3ba9Fc5de1A855AB8adFd8bB1BC37b4f0Cc7e40fbB47e23Ef88bEC3e7A24E",
      "https://vc.example.com/?queryID=0xbDf55e3BFcbb55F2FDcDDd4767ffCDCD8BDeC1E3BDedc082EeF0636caf9eF43f",
      "https://vc.example.com/?queryID=0x05a73A8eACfe6cb2b8d555cFF8aDDd9B7beceaD45fa6c0Ae03FEaE6ED8A0EE79"
    ],
    "certificateName": "ACME Carrier Ecommerce Way Bill Registration Certificate"
  },
  "proof": {
    "type": "Ed25519Signature2018",
    "created": "2021-03-02T20:37:11.778Z",
    "jws": "eyJhbGciOiJFZERTQSIsImI2NCI6ZmFsc2UsImNyaXQiOlsiYjY0Il19..s1S0230zCwMN2OObxTU8cbNkM09P2CL3MnVy7OvNmMGojGc6TwBJhqYUc5NH_C34mSysWcTQgULXkyyWVaYFDg",
    "proofPurpose": "assertionMethod",
    "verificationMethod": "did:example:123#key-0"
  }
}