{
  "@context": [
    "https://www.w3.org/2018/credentials/v1",
    "https://w3id.org/traceability/v1"
  ],
  "id": "https://example.com/credentials/123",
  "type": [
    "VerifiableCredential"
  ],
  "issuanceDate": "2021-02-04T20:29:37+00:00",
  "issuer": {
    "id": "did:example:123"
  },
  "credentialSubject": {
    "id": "did:web:www.acme.com",
    "type": "LegalEntityIdentifierCredential",
    "leiCode": "7VAZV6PSUDBD4F2P3ON6",
    "certificateName": "US Legal Entity Certificate"
  },
  "proof": {
    "type": "Ed25519Signature2018",
    "created": "2021-02-25T17:30:10.248Z",
    "jws": "eyJhbGciOiJFZERTQSIsImI2NCI6ZmFsc2UsImNyaXQiOlsiYjY0Il19..TzEFYcw3RPbjYxC2wHfHTslmlMTJNnx0O2njFABeG6TYr7WzsJfcAIkFLn-OaGRfFb_VwXnUp69TA6XyrKF9AQ",
    "proofPurpose": "assertionMethod",
    "verificationMethod": "did:example:123#key-0"
  }
}