{
  "@context": [
    "https://www.w3.org/2018/credentials/v1",
    "https://w3id.org/traceability/v1"
  ],
  "id": "https://example.com/credentials/123",
  "type": [
    "VerifiableCredential"
  ],
  "issuanceDate": "2021-02-04T20:29:37+00:00",
  "issuer": {
    "id": "did:example:123"
  },
  "credentialSubject": {
    "id": "did:web:www.acme.com",
    "type": "EcommercePackingListRegistrationCredential",
    "packageItems": [
      {
        "type": "EcommercePackingListItem",
        "orderID": "https://vc.example.com/?queryID=AB06f1f744a781480c521902a1a1dbf5f1d01e7ea21daf483e7668817e58597a",
        "productInOrder": [
          "https://vc.example.com/?queryID=7306f1f744a781480c521902a1a1dbf5f1d01e7ea21daf483e7668817e58599e"
        ]
      }
    ],
    "certificateName": "ACME Ecommerce Packing List Registration Credential"
  },
  "proof": {
    "type": "Ed25519Signature2018",
    "created": "2021-02-25T17:11:24.394Z",
    "jws": "eyJhbGciOiJFZERTQSIsImI2NCI6ZmFsc2UsImNyaXQiOlsiYjY0Il19..CLDYKjulIkZtba1Mid_tZApscOFoSdzGXvkXWmK67qECet1OrOg-P8ZE3RoDVBy9wes6LnHNH7fyT5kabidKBg",
    "proofPurpose": "assertionMethod",
    "verificationMethod": "did:example:123#key-0"
  }
}