{
  "@context": [
    "https://www.w3.org/2018/credentials/v1",
    "https://w3id.org/traceability/v1"
  ],
  "id": "https://example.com/credentials/123",
  "type": [
    "VerifiableCredential"
  ],
  "issuanceDate": "2021-02-04T20:29:37+00:00",
  "issuer": {
    "id": "did:example:123"
  },
  "credentialSubject": {
    "id": "did:web:www.acmecarrier.com",
    "type": "EcommerceProductReceiptRegistrationCredential",
    "receiptID": "Receipt#626",
    "packingListID": [
      "https://vc.example.com/?queryID=7306f1f744a781480c521902a1a1dbf5f1d01e7ea21daf483e7668817e58597a"
    ],
    "orderID": [
      "https://vc.example.com/?queryID=7306f1f744a781480c521902a1a1dbf5f1d01e7ea21daf483e7668817e58597a"
    ],
    "productInOrder": [
      "https://vc.example.com/?queryID=6206f1f744a781480c521902a1a1dbf5f1d01e7ea21daf483e7668817e58598a",
      "https://vc.example.com/?queryID=6206f1f744a781480c521902a1a1dbf5f1d01e7ea21daf483e7668817e58598a",
      "https://vc.example.com/?queryID=7306f1f744a781480c521902a1a1dbf5f1d01e7ea21daf483e7668817e58598a",
      "https://vc.example.com/?queryID=7306f1f744a781480c521902a1a1dbf5f1d01e7ea21daf483e7668817e58598a"
    ],
    "certificateName": "ACME Carrier Ecommerce Product Receipt Registration Certificate"
  },
  "proof": {
    "type": "Ed25519Signature2018",
    "created": "2021-03-02T20:37:04.117Z",
    "jws": "eyJhbGciOiJFZERTQSIsImI2NCI6ZmFsc2UsImNyaXQiOlsiYjY0Il19..w6Ijjsy_8OZWB0BJFDukA1Rl5NzqVjHvl9MK_YgycHUyDjdll02Q2c4bdJelbEC707akGhuPqzznuUNzbCLsBg",
    "proofPurpose": "assertionMethod",
    "verificationMethod": "did:example:123#key-0"
  }
}