{
  "@context": [
    "https://www.w3.org/2018/credentials/v1",
    "https://w3id.org/traceability/v1"
  ],
  "id": "https://example.com/credentials/123",
  "type": [
    "VerifiableCredential"
  ],
  "issuanceDate": "2021-02-04T20:29:37+00:00",
  "issuer": {
    "id": "did:example:123"
  },
  "credentialSubject": {
    "id": "did:web:www.acme.com",
    "type": "EcommerceInvoiceRegistrationCredential",
    "invoiceID": "Invoice#213",
    "orderID": [
      "https://vc.example.com/?queryID=AB06f1f744a781480c521902a1a1dbf5f1d01e7ea21daf483e7668817e58597a"
    ],
    "productInOrder": [
      "https://vc.example.com/?queryID=7306f1f744a781480c521902a1a1dbf5f1d01e7ea21daf483e7668817e58598a",
      "https://vc.example.com/?queryID=7306f1f744a781480c521902a1a1dbf5f1d01e7ea21daf483e7668817e58598a"
    ],
    "certificateName": "ACME Ecommerce Invoice Registration Credential"
  },
  "proof": {
    "type": "Ed25519Signature2018",
    "created": "2021-03-02T20:37:07.254Z",
    "jws": "eyJhbGciOiJFZERTQSIsImI2NCI6ZmFsc2UsImNyaXQiOlsiYjY0Il19..sK-MO5FAaKlGgGhwoJ52XOdhniG3H_O5WddCBDzvwLRtII_ct6csiPnmWVbA1hZmYe6pl9zCZippIBq4qZ87CA",
    "proofPurpose": "assertionMethod",
    "verificationMethod": "did:example:123#key-0"
  }
}