{
  "@context": [
    "https://www.w3.org/2018/credentials/v1",
    "https://w3id.org/traceability/v1"
  ],
  "id": "https://example.com/credentials/123",
  "type": [
    "VerifiableCredential"
  ],
  "issuanceDate": "2021-02-04T20:29:37+00:00",
  "issuer": {
    "id": "did:example:123"
  },
  "credentialSubject": {
    "id": "did:web:www.acme.com",
    "type": "EcommerceAdditionalProductCodeRegistrationCredential",
    "productVCid": "https://vc.example.com/?queryID=AB06f1f744a781480c521902a1a1dbf5f1d01e7ea21daf483e7668817e58597a",
    "addProductCode": 30977065546903,
    "addProductCodeType": "CO",
    "certificateName": "ACME Ecommerce Country of Origin Code Product Registration Certificate"
  },
  "proof": {
    "type": "Ed25519Signature2018",
    "created": "2021-02-24T21:34:59.307Z",
    "jws": "eyJhbGciOiJFZERTQSIsImI2NCI6ZmFsc2UsImNyaXQiOlsiYjY0Il19..b02QSXByPtWlM3OxSxwbqhpJ-uG2Frm-efiudYOew_YeEQP_OsvuhGBW8mxLMLzvKhiovVF4VPRrenIIR36ZBw",
    "proofPurpose": "assertionMethod",
    "verificationMethod": "did:example:123#key-0"
  }
}